{
 "$schema_note": "FRYST LEGACY-API. Kontraktet listar exakt de publika medlemmar den levererade koden bär. Generatorn får byta VÄRDE och KÄLLA fritt — men mängden namn måste vara oförändrad. Mäts av TG-01 med EXAKT mängdlikhet i båda riktningarna.",
 "$honesty": "Fas 1: kontrollerna bevisade tidigare bara att utdata stämde med den FÖRÄNDERLIGA mappningen — ett borttaget alias tog bort medlemmen ur Dart utan att något reagerade. Ytan nedan är fryst ur den LEVERERADE koden, inte ur app-repot. Påståendet att den motsvarar appens faktiska anrop är därför OVERIFIERAT och bevisas i Fas 2, när app-repot låses till en commit och analyseras (styrdokumentet § 9E). Kontraktet skyddar mot regression i den här leveransen, inte mot ett felaktigt utgångsläge.",
 "version": "1.0",
 "frozen": "2026-08-04",
 "source": "lib/theme/app_colors.dart + lib/theme/app_text_styles.dart, generation ur tokens 1.12",
 "appColors": {
  "members": [
   "accent",
   "actionDanger",
   "actionDangerPressed",
   "actionPrimary",
   "actionPrimaryPressed",
   "backgroundDark",
   "backgroundLight",
   "backgroundTint",
   "borderOnInk",
   "brandAllrecipes",
   "brandAppleBlack",
   "brandAppleWhite",
   "brandArla",
   "brandCoop",
   "brandFacebook",
   "brandGeneric",
   "brandGoogle",
   "brandGoogleButtonDark",
   "brandGoogleButtonDarkBackground",
   "brandGoogleButtonDarkText",
   "brandGoogleButtonLight",
   "brandGoogleButtonLightBackground",
   "brandGoogleButtonLightText",
   "brandGoogleGreen",
   "brandGoogleRed",
   "brandGoogleYellow",
   "brandIca",
   "brandInstagram",
   "brandInstagramBackground",
   "brandInstagramText",
   "brandKoketSe",
   "brandPinterest",
   "brandReddit",
   "brandTelegram",
   "brandTiktok",
   "brandTiktokBackground",
   "brandTiktokText",
   "brandTwitter",
   "brandWhatsapp",
   "brandYoutube",
   "brandYoutubeBackground",
   "brandYoutubeText",
   "cardWhite",
   "cardWhite54",
   "categoryBreadGrains",
   "categoryDairy",
   "categoryDryGoods",
   "categoryFrozen",
   "categoryFruit",
   "categoryMeatFish",
   "categoryOther",
   "categoryVegetables",
   "chatBubbleIncoming",
   "chatBubbleOutgoing",
   "chatTextIncoming",
   "chatTextOutgoing",
   "controlCheckedBackground",
   "cream",
   "creamDark",
   "creamDarker",
   "divider",
   "error",
   "errorContainer",
   "focusRing",
   "forestGreen",
   "forestGreenDark",
   "forestGreenLight",
   "greenMuted",
   "greenPale",
   "headerAccent",
   "headerBackground",
   "headerForeground",
   "illustrationBrown",
   "illustrationOrange",
   "illustrationPurpleRed",
   "info",
   "infoContainer",
   "navBackground",
   "navSelectedIndicator",
   "navSelectedItem",
   "navUnselectedItem",
   "neutralDark",
   "neutralLight",
   "neutralMedium",
   "onActionDanger",
   "onActionPrimary",
   "onActionPrimaryPressed",
   "onError",
   "onErrorContainer",
   "onInfo",
   "onInfoContainer",
   "onPrimary",
   "onPrimaryContainer",
   "onSuccess",
   "onSuccessContainer",
   "onSurface",
   "onWarning",
   "onWarningContainer",
   "outline",
   "overlay",
   "overlayBlack10",
   "overlayBlack20",
   "overlayBlack40",
   "overlayBlack60",
   "overlayWhite40",
   "placeholderIcon",
   "primary",
   "primaryContainer",
   "progressIndicator",
   "progressTrack",
   "recipeCardBottomBorder",
   "recipeCardLeftBorder",
   "recipeMeta",
   "rust",
   "rustLight",
   "secondary",
   "secondaryContainer",
   "secondaryPurple",
   "sectionHeader",
   "shadow",
   "shadowColor",
   "sharedRecipeBackground",
   "sharedRecipeBackgroundColor",
   "sharedRecipeIcon",
   "sharedRecipeIconColor",
   "sharedRecipeText",
   "sharedRecipeTextColor",
   "starGold",
   "success",
   "successContainer",
   "surface",
   "surfaceDark",
   "surfaceDisabled",
   "surfacePressedOnInk",
   "surfacePressedOnRaised",
   "surfaceSelected",
   "surfaceTintAccent",
   "surfaceTintDanger",
   "surfaceTintSuccess",
   "surfaceTintWarning",
   "surfaceVariant",
   "textAccent",
   "textAccentOnInk",
   "textBodyMuted",
   "textCompleted",
   "textDark",
   "textDisabled",
   "textDisabledOnBase",
   "textDisabledOnInk",
   "textLight",
   "textLink",
   "textMedium",
   "textOnCream",
   "textOnPrimary",
   "textSecondary",
   "textTertiary",
   "textWarning",
   "transparent",
   "warning",
   "warningContainer",
   "warningText"
  ],
  "colorSchemes": [
   "darkColorScheme",
   "lightColorScheme"
  ]
 },
 "appTextStyles": {
  "getters": [
   "appBarTitle",
   "badge",
   "badgeLarge",
   "badgeText",
   "bodyBold",
   "bodyLarge",
   "bodyLargeBold",
   "bodyLargeLight",
   "bodyMedium",
   "bodyMediumError",
   "bodyMediumMuted",
   "bodyMediumSuccess",
   "bodyMediumWarning",
   "bodySmall",
   "bodySmallBold",
   "buttonPrimary",
   "buttonText",
   "buttonTextLight",
   "buttonTextStyle",
   "calendarCell",
   "captionBase",
   "captionBold",
   "captionText",
   "cardTitle",
   "cardTitleStyle",
   "contentLabel",
   "contentTitle",
   "cookingStep",
   "dialogContent",
   "dialogTitle",
   "displaySmall",
   "emptyStateBody",
   "emptyStateTitle",
   "filterChip",
   "formOption",
   "groupTitle",
   "headerCountBadge",
   "headerTitle",
   "headlineBold",
   "headlineMedium",
   "headlineSmall",
   "hintText",
   "infoText",
   "labelLarge",
   "labelMedium",
   "labelMediumBold",
   "labelMediumMuted",
   "labelSmall",
   "labelSmallSuccess",
   "labelText",
   "linkSmall",
   "listTileSubtitle",
   "listTileTitle",
   "mainViewTitle",
   "metadataEmphasized",
   "navLabel",
   "navigationText",
   "overline",
   "recipeCardDescription",
   "recipeCardMeta",
   "recipeCardTitle",
   "recipeMeta",
   "recipeMetaBase",
   "sectionHeader",
   "sectionHeading",
   "snackbarText",
   "statNumber",
   "subpageTitle",
   "successText",
   "tabText",
   "textSm",
   "textXs",
   "textXsBold",
   "titleBold",
   "titleLarge",
   "titleLargeBold",
   "titleMedium",
   "titleMediumMuted",
   "titleSmall",
   "warningText"
  ],
  "stringConstants": [
   "bodyFont",
   "family",
   "headerFont"
  ]
 },
 "$schema": "legacy-api-contract.schema.json",
 "appColorsDark": {
  "$note": "EGET kontrakt for den morka leveransen. Den ljusa ytan ovan ar orord och far inte vaxa for mork mods skull - tva forsok att gora det foll pa namnkrockar respektive pa att kontrollen laser filen som EN yta.",
  "artifact": "lib/theme/app_colors_dark.dart",
  "generator": "tools/gen-app-theme-dark.mjs",
  "mode": "dark",
  "source": "tokens.json · semantic[*].dark",
  "$regel": "Varje medlem MASTE vara det morka laget av ett semantiskt token i tokens.json. Ingen appforfattad kanonisk farg far sta har, ingen paletfarg (de saknar lagesberoende), och ingen medlem far forekomma tva ganger. Medlemsnamnen ar desamma som i den ljusa leveransen.",
  "members": [
   "actionDanger",
   "actionDangerPressed",
   "actionPrimary",
   "actionPrimaryPressed",
   "backgroundTint",
   "borderOnInk",
   "cardWhite",
   "cardWhite54",
   "controlCheckedBackground",
   "cream",
   "creamDark",
   "creamDarker",
   "divider",
   "error",
   "errorContainer",
   "focusRing",
   "forestGreen",
   "greenMuted",
   "greenPale",
   "info",
   "infoContainer",
   "neutralLight",
   "onActionDanger",
   "onActionPrimary",
   "onActionPrimaryPressed",
   "onErrorContainer",
   "onInfoContainer",
   "onSuccessContainer",
   "onWarningContainer",
   "overlay",
   "overlayBlack10",
   "overlayBlack20",
   "overlayBlack40",
   "overlayBlack60",
   "overlayWhite40",
   "placeholderIcon",
   "progressIndicator",
   "progressTrack",
   "recipeCardLeftBorder",
   "recipeMeta",
   "rustLight",
   "sectionHeader",
   "shadowColor",
   "sharedRecipeBackground",
   "sharedRecipeText",
   "success",
   "successContainer",
   "surfaceDisabled",
   "surfacePressedOnInk",
   "surfacePressedOnRaised",
   "surfaceSelected",
   "surfaceTintAccent",
   "surfaceTintDanger",
   "surfaceTintSuccess",
   "surfaceTintWarning",
   "textAccent",
   "textAccentOnInk",
   "textBodyMuted",
   "textCompleted",
   "textDark",
   "textDisabled",
   "textDisabledOnBase",
   "textDisabledOnInk",
   "textLight",
   "textLink",
   "textMedium",
   "textOnCream",
   "textOnPrimary",
   "textWarning",
   "warning",
   "warningContainer"
  ],
  "aliases": [
   "backgroundLight",
   "chatBubbleIncoming",
   "chatBubbleOutgoing",
   "chatTextIncoming",
   "chatTextOutgoing",
   "headerBackground",
   "headerForeground",
   "navBackground",
   "navUnselectedItem",
   "onError",
   "onInfo",
   "onPrimary",
   "onPrimaryContainer",
   "onSuccess",
   "onSurface",
   "onWarning",
   "outline",
   "primary",
   "primaryContainer",
   "recipeCardBottomBorder",
   "secondaryContainer",
   "shadow",
   "sharedRecipeBackgroundColor",
   "sharedRecipeTextColor",
   "surface",
   "surfaceVariant",
   "textSecondary",
   "warningText"
  ],
  "semanticTokens": [
   "action.danger",
   "action.dangerPressed",
   "action.primary",
   "action.primaryPressed",
   "border.cardEdge",
   "border.control",
   "border.onInk",
   "border.statusWarning",
   "border.subtle",
   "control.checked.background",
   "control.checked.foreground",
   "elevation.shadow",
   "focusRing",
   "overlay.inkLight",
   "overlay.inkMedium",
   "overlay.inkStrong",
   "overlay.inkSubtle",
   "overlay.paperCard",
   "overlay.paperWash",
   "progressIndicator",
   "progressTrack",
   "scrim",
   "surface.base",
   "surface.disabled",
   "surface.ink",
   "surface.pressed.onInk",
   "surface.pressed.onRaised",
   "surface.raised",
   "surface.selected",
   "surface.tint.accent",
   "surface.tint.danger",
   "surface.tint.success",
   "surface.tint.warning",
   "text.accent",
   "text.accent.onInk",
   "text.accent.onRaised",
   "text.body",
   "text.bodyMuted",
   "text.completed",
   "text.danger",
   "text.danger.onRaised",
   "text.disabled",
   "text.disabled.onInk",
   "text.disabled.onRaised",
   "text.link",
   "text.onActionDanger",
   "text.onActionPrimary",
   "text.onActionPrimaryPressed",
   "text.primary",